{"createdAt":"2026-07-27T04:56:45.011Z","files":[{"bytes":312382,"path":"catalog_v0.json","sha256":"51bb2d33e90b66c688508606c2abccbc3d74873a9649b26f0c13af29b19070e9"},{"bytes":76987,"path":"cross_pass_v0.json","sha256":"f4f38cc84a6660e825f3ce884119146bc48fd65e1f39846c2339f66ae52ffe51"},{"bytes":353411,"path":"heading_v0.json","sha256":"eccf05f40b6baba3a588296b92b0e60494955f04b14154b3cfe92786da8ad96c"},{"bytes":89,"path":"bev_v0.json","sha256":"819d0e7ae67105984dabee7bf474e78e5ae0a7ce88169af4e89e302d003d62c8"},{"bytes":7144,"path":"exclusions_v0.json","sha256":"d15e14a7a29fa842dd86ef1175006ac7d266f07d9bc8ea0c2bea1d75bd41a067"},{"bytes":104,"path":"unassociated_v0.json","sha256":"69dcaa5ec35aa5ffe7395c641e744d0d648959190337e66428163c58702d5342"},{"bytes":792,"path":"promotion_v0.json","sha256":"3ab8bd6c617d63fc05e132e15edcc84e38a6c9929ae350673efa467a2d2dd0cd"},{"bytes":325,"path":"assessment_0_0_2_interval_0_0_2_22_run_0_0_0_2_21_run_0_244.2_294.5.json","sha256":"053f66c78461044ae575e4fbbe493129d6103c7a64c454c753600d4b2a71f265"},{"bytes":321,"path":"assessment_0_0_3_interval_0_0_3_6_run_0_0_0_3_5_run_0_25.1_74.5.json","sha256":"76fe33cc42919bb1bc99b1fe2f603e8fbc06df18714e823f303d560f3390c01b"},{"bytes":321,"path":"assessment_0_0_4_interval_0_0_4_1_run_0_0_0_4_0_run_0_1.3_160.3.json","sha256":"071d85abca7da7311068f3725943ee89079cd9f12c6c9e28d338e2782cfbc6d1"},{"bytes":321,"path":"assessment_0_0_4_interval_0_0_4_2_run_0_0_0_4_1_run_0_1.5_160.3.json","sha256":"75df328f31974102456564b7a5e0135b54744dc99efec12cae1336eabe532c03"},{"bytes":322,"path":"assessment_0_1_4_interval_0_1_4_3_run_0_0_1_4_2_run_0_89.2_115.2.json","sha256":"d88e40d5be6e42e4aabf8c3574abf2757876cf9f2576f1653408e447d4f37047"}],"processingVersion":"2026-07-24-dataset-sensitivity-bev-audit-v0","runId":"stage19-2026-07-27T04-56-43-772Z","schemaVersion":"stage19_manifest_v0"}