{"createdAt":"1970-01-01T00:00:00.000Z","files":[{"bytes":376,"path":"assessment_0_0_2_interval_0_0_2_22_run_0_0_0_2_21_run_0_244.2_294.5.json","sha256":"5041bce2cfb9b7a9c8ed7accf42ec1a0dbda1b0d6e676b95c2f6b7f60a2edbe6"},{"bytes":372,"path":"assessment_0_0_3_interval_0_0_3_6_run_0_0_0_3_5_run_0_25.1_74.5.json","sha256":"56255a5b744bae9c298bba54f6d9453656adec4c6a6f87d7e570f3615025961b"},{"bytes":372,"path":"assessment_0_0_4_interval_0_0_4_1_run_0_0_0_4_0_run_0_1.3_160.3.json","sha256":"cfbc3d62ab1f06bf3cbb12c210bc1d470756bb9ced1cf298c3d91a1959561286"},{"bytes":372,"path":"assessment_0_0_4_interval_0_0_4_2_run_0_0_0_4_1_run_0_1.5_160.3.json","sha256":"77765034322fd4ef36793cdcb1d36bb639c1fd4138b3228adcdb6b0c9ddcb88c"},{"bytes":373,"path":"assessment_0_1_4_interval_0_1_4_3_run_0_0_1_4_2_run_0_89.2_115.2.json","sha256":"930f159edbf7bea6731d5deb85d518a44c3c6e9c926c810f6d19e9621d536b30"},{"bytes":1628,"path":"bev_v0.json","sha256":"5a03fc8ec03114fe006f55fa0435782b810e8cc15c42d63eb0b7059057da956e"},{"bytes":312371,"path":"catalog_v0.json","sha256":"6f7583370668b0006aad23e7c818d94e2b10390bdbe30ff47f401f929d482853"},{"bytes":864,"path":"cross_pass_v0.json","sha256":"c8fe3f634d6583fbf8d1be48572d9932e8f1e46f31e46e25a871a249b263a28e"},{"bytes":7133,"path":"exclusions_v0.json","sha256":"2dd39cff2ca2a66224d6d14dbade6e1356747d27d7fc0ec7f26616100f8cd849"},{"bytes":83,"path":"heading_v0.json","sha256":"d96be7a415e745d27090c8219b9c7b7543934833c143b322f8371ad8187399a1"},{"bytes":79427,"path":"payloads/stage18_bev_curved_road_intervals.png","sha256":"f0b385a54cac28faed707379c28e84f6089946f0956fd225c8e2a4e4f49af630"},{"bytes":23607,"path":"payloads/stage18_bev_missing_outer_boundary.png","sha256":"21137ab2223c6df954fdfaacdd4536c61d0617c4f704a79c77b2ea8bfcc1de4a"},{"bytes":54454,"path":"payloads/stage18_bev_stable_one_lane_interval.png","sha256":"96552c5c2ac8ae167815c9c93b721a1af996c687edd45e4444b229661d8eea4b"},{"bytes":22152,"path":"payloads/stage18_bev_stable_two_lane_assessment.png","sha256":"4d7bf37687068734518346857862f18271e83c1af486ebc3ad14617708d0ff8c"},{"bytes":42731,"path":"payloads/stage18_bev_stage16_stage17_coverage_outlier.png","sha256":"6a5c6fa3a3789b0b00ed1d48e76461cc0471305c9ab43da19e945846c8bea23b"},{"bytes":701,"path":"promotion_v0.json","sha256":"5e6b9c8935065e530427640b5526ccfa7c7efc309019bd8f713b736bc21cc535"},{"bytes":3168,"path":"sensitivity_v0.json","sha256":"1227aba85de0dd6450a864565cfdc02eac217ad4654c09226f879f3c53e0b07e"},{"bytes":93,"path":"unassociated_v0.json","sha256":"784c677228345ed8d83747593efd665eb057ea2fece7e4d95b47d9a5894e3652"}],"processingVersion":"2026-07-24-dataset-sensitivity-bev-audit-v0","runId":"2026-07-27-stage19-v3","schemaVersion":"stage19_manifest_v0"}