{"createdAt":"2026-07-27T05:18:59.981Z","files":[{"bytes":312382,"path":"catalog_v0.json","sha256":"d4fcd7c6be2b1311d33d7f67b65514fc1131b546423dceee99d6a774a06d089f"},{"bytes":76987,"path":"cross_pass_v0.json","sha256":"a7093ca92b53e4f7095af5d883b3f8b04dd0b3ab45f4d3ef322ae0ce2a76386b"},{"bytes":357856,"path":"heading_v0.json","sha256":"5b484ea1313813c5c6e295e7a924bc1987a10ea89b0d3a475fe1e4d90d114b99"},{"bytes":89,"path":"bev_v0.json","sha256":"c3a192dfe17cedebe6b4ff61693ffa1e6573a23162087aac89e1733a8738fa34"},{"bytes":7144,"path":"exclusions_v0.json","sha256":"629c20ac8a6328760e0ae420ba9e3703b0f0d4ee592e503cccb85fdd35d80d95"},{"bytes":104,"path":"unassociated_v0.json","sha256":"03c521929f91bc0394b869acd2606b0e2a1a13c129e85ab3c629b5b6a8107855"},{"bytes":792,"path":"promotion_v0.json","sha256":"99f375095bf468800ca91349bfccee697457fa184557e536024b9b04fb3347fc"},{"bytes":327,"path":"assessment_0_0_2_interval_0_0_2_22_run_0_0_0_2_21_run_0_244.2_294.5.json","sha256":"1e0a0e313d15d78f5f0ebc0e72e1349ff22aa5533509c8bd634dd5febc807fae"},{"bytes":323,"path":"assessment_0_0_3_interval_0_0_3_6_run_0_0_0_3_5_run_0_25.1_74.5.json","sha256":"f1c4e2baa02cf31e38c95171ef2119c83e64a6b1a7bd86012267aa33575d404a"},{"bytes":323,"path":"assessment_0_0_4_interval_0_0_4_1_run_0_0_0_4_0_run_0_1.3_160.3.json","sha256":"58cc587592529b0229c09449f4a95b6c9cd8029e1aa291c58ed4b4169455d2c1"},{"bytes":323,"path":"assessment_0_0_4_interval_0_0_4_2_run_0_0_0_4_1_run_0_1.5_160.3.json","sha256":"6747bf8cb5f1d55a02ef79b685821df3609c68becf91726fb818e880085f14d8"},{"bytes":324,"path":"assessment_0_1_4_interval_0_1_4_3_run_0_0_1_4_2_run_0_89.2_115.2.json","sha256":"dd540c3ac82c4688145b15ec9d67d67c038f0dbdef70b3c536eb5284e144829f"}],"processingVersion":"2026-07-24-dataset-sensitivity-bev-audit-v0","runId":"stage19-2026-07-27T05-18-10-863Z","schemaVersion":"stage19_manifest_v0"}