{"createdAt":"1970-01-01T00:00:00.000Z","files":[{"bytes":376,"path":"assessment_0_0_2_interval_0_0_2_22_run_0_0_0_2_21_run_0_244.2_294.5.json","sha256":"84a6596226e0354e42484374da5eb07a67b2e73601955a884a66919217015ef2"},{"bytes":372,"path":"assessment_0_0_3_interval_0_0_3_6_run_0_0_0_3_5_run_0_25.1_74.5.json","sha256":"dbcb2d3fc3b8d409d68b54b5f33f3286dc090864454d8f0172908d1250f4f486"},{"bytes":372,"path":"assessment_0_0_4_interval_0_0_4_1_run_0_0_0_4_0_run_0_1.3_160.3.json","sha256":"8e11c63e3c739d589cebb8e0d0dc5f4974d8747286102218dd415d69d1ff2aec"},{"bytes":372,"path":"assessment_0_0_4_interval_0_0_4_2_run_0_0_0_4_1_run_0_1.5_160.3.json","sha256":"204c13eb1c76c4bcea60a07bdde4ae69dcf28110b32905fd1247e9ae0e37c11e"},{"bytes":373,"path":"assessment_0_1_4_interval_0_1_4_3_run_0_0_1_4_2_run_0_89.2_115.2.json","sha256":"49271690b6cd9dfb1703e2e4e6f714f451f1f132399752214471508735759fb3"},{"bytes":1628,"path":"bev_v0.json","sha256":"28e5d83d921a19254aa95fa3cd58d9a27d2c9134f0611abd3ba32d247581c9d0"},{"bytes":312371,"path":"catalog_v0.json","sha256":"943cf74ad3b870d7705725cfe62056178bbd427652c93127535c630516ad276d"},{"bytes":864,"path":"cross_pass_v0.json","sha256":"854c7e1049908ef0a9510a08d35b2652e3296dfc5206fb4d0bb7cc9c3872635b"},{"bytes":7133,"path":"exclusions_v0.json","sha256":"750b3b222f1b6a60213ecf85b6ad2942e62876c556b72ca4ce7e94b3ca891d42"},{"bytes":83,"path":"heading_v0.json","sha256":"13603565531f9917b2728d8dcd0609fc61f16ac160685694a4a1605596186f8f"},{"bytes":79427,"path":"payloads/stage18_bev_curved_road_intervals.png","sha256":"f0b385a54cac28faed707379c28e84f6089946f0956fd225c8e2a4e4f49af630"},{"bytes":23607,"path":"payloads/stage18_bev_missing_outer_boundary.png","sha256":"21137ab2223c6df954fdfaacdd4536c61d0617c4f704a79c77b2ea8bfcc1de4a"},{"bytes":54454,"path":"payloads/stage18_bev_stable_one_lane_interval.png","sha256":"96552c5c2ac8ae167815c9c93b721a1af996c687edd45e4444b229661d8eea4b"},{"bytes":22152,"path":"payloads/stage18_bev_stable_two_lane_assessment.png","sha256":"4d7bf37687068734518346857862f18271e83c1af486ebc3ad14617708d0ff8c"},{"bytes":42731,"path":"payloads/stage18_bev_stage16_stage17_coverage_outlier.png","sha256":"6a5c6fa3a3789b0b00ed1d48e76461cc0471305c9ab43da19e945846c8bea23b"},{"bytes":701,"path":"promotion_v0.json","sha256":"b28d03ce4acae246a0f3c3d1a0e43ebe7777d77bfc4d1980260b854ee670b38f"},{"bytes":3168,"path":"sensitivity_v0.json","sha256":"1227aba85de0dd6450a864565cfdc02eac217ad4654c09226f879f3c53e0b07e"},{"bytes":93,"path":"unassociated_v0.json","sha256":"45315aac4ff238a18b6aeae11c8eebb4ef1a12c2f542a55d1220cb7c9b3da808"}],"processingVersion":"2026-07-24-dataset-sensitivity-bev-audit-v0","runId":"2026-07-27-stage19-v2","schemaVersion":"stage19_manifest_v0"}