{"createdAt":"1970-01-01T00:00:00.000Z","files":[{"bytes":376,"path":"assessment_0_0_2_interval_0_0_2_22_run_0_0_0_2_21_run_0_244.2_294.5.json","sha256":"897390bd2fa77e9fac451a74165a4670f76f144ef059c3f2b41b300145d666d7"},{"bytes":372,"path":"assessment_0_0_3_interval_0_0_3_6_run_0_0_0_3_5_run_0_25.1_74.5.json","sha256":"e2e92bfc4381706af2ae09ba0005075febd58cb69ceece22bf20f9a06a4c8c76"},{"bytes":372,"path":"assessment_0_0_4_interval_0_0_4_1_run_0_0_0_4_0_run_0_1.3_160.3.json","sha256":"e858add612ef387fcd810d6f729ecf0331e46f0f995fb8615c1cc45fdbed7846"},{"bytes":372,"path":"assessment_0_0_4_interval_0_0_4_2_run_0_0_0_4_1_run_0_1.5_160.3.json","sha256":"7a3009377b29520bb82a879e1a0419fab472e8ba682565b4e60192ebd776e9ac"},{"bytes":373,"path":"assessment_0_1_4_interval_0_1_4_3_run_0_0_1_4_2_run_0_89.2_115.2.json","sha256":"91ff1c94146292ab9031c29741996956fd013075e25f31b61895416a1076b281"},{"bytes":1628,"path":"bev_v0.json","sha256":"9fd910557b8578d408a1b650310a169ed9aa38d0e70261a57ff4fcc6354adaad"},{"bytes":312371,"path":"catalog_v0.json","sha256":"d01414ecb6a04c1abddc4020c50ac796ad26a8387bace272067b3589babe4423"},{"bytes":864,"path":"cross_pass_v0.json","sha256":"17fdc58dcf06fb71453e067e6396e7d872db2f48446991d0881ec937453b3ad6"},{"bytes":7133,"path":"exclusions_v0.json","sha256":"d47f739a620603f94b9cd28f83560d9b75d1ee378b01d4800f158c9a4668a9cc"},{"bytes":83,"path":"heading_v0.json","sha256":"dd72a813761b97bbedff44e74f8cf11a033a565a8ddbbd667262cbbcefb7722f"},{"bytes":79427,"path":"payloads/stage18_bev_curved_road_intervals.png","sha256":"f0b385a54cac28faed707379c28e84f6089946f0956fd225c8e2a4e4f49af630"},{"bytes":23607,"path":"payloads/stage18_bev_missing_outer_boundary.png","sha256":"21137ab2223c6df954fdfaacdd4536c61d0617c4f704a79c77b2ea8bfcc1de4a"},{"bytes":54454,"path":"payloads/stage18_bev_stable_one_lane_interval.png","sha256":"96552c5c2ac8ae167815c9c93b721a1af996c687edd45e4444b229661d8eea4b"},{"bytes":22152,"path":"payloads/stage18_bev_stable_two_lane_assessment.png","sha256":"4d7bf37687068734518346857862f18271e83c1af486ebc3ad14617708d0ff8c"},{"bytes":42731,"path":"payloads/stage18_bev_stage16_stage17_coverage_outlier.png","sha256":"6a5c6fa3a3789b0b00ed1d48e76461cc0471305c9ab43da19e945846c8bea23b"},{"bytes":701,"path":"promotion_v0.json","sha256":"4fe17d04b404157976b967668fcd5d278a2e1167d6211adf930de29ae6d52c33"},{"bytes":3168,"path":"sensitivity_v0.json","sha256":"1227aba85de0dd6450a864565cfdc02eac217ad4654c09226f879f3c53e0b07e"},{"bytes":93,"path":"unassociated_v0.json","sha256":"09a1cc5c05431c75ad76a13936307642bd02a32fd94237373ed176948c751bce"}],"processingVersion":"2026-07-24-dataset-sensitivity-bev-audit-v0","runId":"2026-07-27-stage19-v5","schemaVersion":"stage19_manifest_v0"}